EAM,130,Overview of Entertainment and Arts Management,3.00,,,TERMS-OFFERED,0
EAM,365,Media and Entertainment Business,3.00,,,TERMS-OFFERED,0
EAM,391,"Promotion, Press and Publicity",3.00,,,TERMS-OFFERED,0
EAM,401,Writing for Arts Managers,3.00,ENGL103 or ENGL105 or HUM108 and EAM312,,TERMS-OFFERED,0
EAM,461,Entertainment Publishing,3.00,EAM361,,TERMS-OFFERED,0
EAM,321,Box Office and Venue Management,3.00,EAM211,,TERMS-OFFERED,0
EAM,399,Entertainment Law Asst.,12.00,,,TERMS-OFFERED,0
EAM,491,Entertainment and Arts Management Senior Project,1.00,,,TERMS-OFFERED,0
