HSCI,201,Health Assessment through the Lifespan,4.00,ANAT103,,TERMS-OFFERED,0
HSCI,302,Pharmacology II,3.00,HSCI301,,TERMS-OFFERED,0
HSCI,310,Introduction to Clinical Research,4.00,,,TERMS-OFFERED,0
HSCI,313,Clinical Trials Protocols,4.00,HSCI310,,TERMS-OFFERED,0
HSCI,430,Developmental Anatomy,4.00,ANAT101 and ANAT102 and ANAT103,,TERMS-OFFERED,0
HSCI,480,ST: Fundamentals of Toxicology,1.00 to 12.00,,,TERMS-OFFERED,0
HSCI,326,Applied Anatomy and Kinesiology,4.00,ANAT101 and ANAT102 and ANAT103,,TERMS-OFFERED,0
